{
	"$schema": "http://json-schema.org/draft-07/schema#",
	"$defs": {
		"blockStateProperty": {
			"type": "object",
			"properties": {
				"type": {
					"enum": ["string", "int", "byte"]
				},
				"value": {
					"type": ["string", "integer"]
				}
			}
		}
	},
	"type": "object",
	"additionalProperties": false,
	"required": [
		"maxVersionMajor",
		"maxVersionMinor",
		"maxVersionPatch",
		"maxVersionRevision"
	],
	"properties": {
		"maxVersionMajor": {
			"type": "integer",
			"minValue": 0
		},
		"maxVersionMinor": {
			"type": "integer",
			"minValue": 0
		},
		"maxVersionPatch": {
			"type": "integer",
			"minValue": 0
		},
		"maxVersionRevision": {
			"type": "integer",
			"minValue": 0
		},
		"renamedIds": {
			"type": "object",
			"additionalProperties": {
				"type": "string"
			}
		},
		"renamedProperties": {
			"type": "object",
			"additionalProperties": {
				"type": "object",
				"additionalProperties": {
					"type": "string"
				}
			}
		},
		"addedProperties": {
			"type": "object",
			"additionalProperties": {
				"type": "object",
				"additionalProperties": {
					"$ref": "#/$defs/blockStateProperty"
				}
			}
		},
		"removedProperties": {
			"type": "object",
			"additionalProperties": {
				"type": "array",
				"items": {
					"type": "string"
				}
			}
		},
		"remappedPropertyValues": {
			"type": "object",
			"additionalProperties": {
				"type": "object",
				"additionalProperties": {
					"type": "string"
				}
			}
		},
		"remappedPropertyValuesIndex": {
			"type": "object",
			"additionalProperties": {
				"type": "array",
				"items": {
					"type": "object",
					"properties": {
						"old": {
							"$ref": "#/$defs/blockStateProperty"
						},
						"new": {
							"$ref": "#/$defs/blockStateProperty"
						}
					}
				}
			}
		},
		"remappedStates": {
			"type": "object",
			"additionalProperties": {
				"type": "array",
				"items": {
					"type": "object",
					"properties": {
						"oldState": {
							"type": "object",
							"additionalProperties": {
								"$ref": "#/$defs/blockStateProperty"
							}
						},
						"newId": {
							"type": "string"
						},
						"newState": {
							"type": "object",
							"additionalProperties": {
								"$ref": "#/$defs/blockStateProperty"
							}
						}
					}
				}
			}
		}
	}
}
