{
    "maxVersionMajor": 1,
    "maxVersionMinor": 18,
    "maxVersionPatch": 10,
    "maxVersionRevision": 1,
    "addedProperties": {
        "minecraft:ochre_froglight": {
            "pillar_axis": {
                "string": "y"
            }
        },
        "minecraft:pearlescent_froglight": {
            "pillar_axis": {
                "string": "y"
            }
        },
        "minecraft:verdant_froglight": {
            "pillar_axis": {
                "string": "y"
            }
        }
    }
}
