{
    "maxVersionMajor": 1,
    "maxVersionMinor": 12,
    "maxVersionPatch": 0,
    "maxVersionRevision": 1,
    "addedProperties": {
        "minecraft:barrel": {
            "open_bit": {
                "type": "byte",
                "value": 0
            }
        },
        "minecraft:bell": {
            "toggle_bit": {
                "type": "byte",
                "value": 0
            }
        },
        "minecraft:campfire": {
            "direction": {
                "type": "int",
                "value": 0
            },
            "extinguished": {
                "type": "byte",
                "value": 0
            }
        },
        "minecraft:lectern": {
            "powered_bit": {
                "type": "byte",
                "value": 0
            }
        }
    },
    "renamedProperties": {
        "minecraft:blast_furnace": {
            "direction": "facing_direction"
        },
        "minecraft:composter": {
            "fill_level": "composter_fill_level"
        },
        "minecraft:coral_fan": {
            "direction": "coral_fan_direction"
        },
        "minecraft:coral_fan_dead": {
            "direction": "coral_fan_direction"
        },
        "minecraft:smoker": {
            "direction": "facing_direction"
        }
    },
    "remappedPropertyValues": {
        "minecraft:barrel": {
            "facing_direction": "facing_direction_00"
        },
        "minecraft:blast_furnace": {
            "direction": "direction_01"
        },
        "minecraft:smoker": {
            "direction": "direction_01"
        }
    },
    "remappedPropertyValuesIndex": {
        "facing_direction_00": [
            {
                "old": {
                    "type": "int",
                    "value": 7
                },
                "new": {
                    "type": "int",
                    "value": 0
                }
            },
            {
                "old": {
                    "type": "int",
                    "value": 6
                },
                "new": {
                    "type": "int",
                    "value": 0
                }
            }
        ],
        "direction_01": [
            {
                "old": {
                    "type": "int",
                    "value": 0
                },
                "new": {
                    "type": "int",
                    "value": 3
                }
            },
            {
                "old": {
                    "type": "int",
                    "value": 1
                },
                "new": {
                    "type": "int",
                    "value": 4
                }
            },
            {
                "old": {
                    "type": "int",
                    "value": 3
                },
                "new": {
                    "type": "int",
                    "value": 5
                }
            }
        ]
    }
}
