{
    "maxVersionMajor": 1,
    "maxVersionMinor": 16,
    "maxVersionPatch": 0,
    "maxVersionRevision": 16,
    "addedProperties": {
        "minecraft:chain": {
            "pillar_axis": {
                "type": "string",
                "value": "y"
            }
        }
    },
    "renamedProperties": {
        "minecraft:bee_nest": {
            "facing_direction": "direction"
        },
        "minecraft:beehive": {
            "facing_direction": "direction"
        }
    },
    "remappedPropertyValues": {
        "minecraft:bee_nest": {
            "facing_direction": "facing_direction_00"
        },
        "minecraft:beehive": {
            "facing_direction": "facing_direction_00"
        }
    },
    "remappedPropertyValuesIndex": {
        "facing_direction_00": [
            {
                "old": {
                    "type": "int",
                    "value": 4
                },
                "new": {
                    "type": "int",
                    "value": 1
                }
            },
            {
                "old": {
                    "type": "int",
                    "value": 3
                },
                "new": {
                    "type": "int",
                    "value": 0
                }
            },
            {
                "old": {
                    "type": "int",
                    "value": 5
                },
                "new": {
                    "type": "int",
                    "value": 3
                }
            },
            {
                "old": {
                    "type": "int",
                    "value": 1
                },
                "new": {
                    "type": "int",
                    "value": 0
                }
            }
        ]
    }
}
